<?xml version="1.0" encoding="UTF-8"?>
<Saglasnost xmlns="http://www.ftn.uns.ac.rs/xml_i_veb_servisi/obrazac_saglasnosti_za_imunizaciju"
    xmlns:xsi="http://www.w3.org/2001/XMLSchema-instance"
	xmlns:jxb="http://java.sun.com/xml/ns/jaxb"
    xmlns:pred="http://www.ftn.uns.ac.rs/xml_i_veb_servisi/rdf/obrazac_saglasnosti_za_imunizaciju/predicate/"
    xsi:schemaLocation="http://www.ftn.uns.ac.rs/xml_i_veb_servisi/obrazac_saglasnosti_za_imunizaciju ../schema/saglasnost.xsd"
    about="http://www.ftn.uns.ac.rs/xml_i_veb_servisi/obrazac_saglasnosti_za_imunizaciju/54321"
    Broj_saglasnosti="54321"
    vocab="http://www.ftn.uns.ac.rs/xml_i_veb_servisi/rdf/obrazac_saglasnosti_za_imunizaciju/predicate/">
    <Pacijent>
        <Drzavljanin_srbije>
            <Jmbg property="pred:jmbg">3216549877418</Jmbg>
        </Drzavljanin_srbije>
        <Licni_podaci>
            <Prezime property="pred:prezime">Mikic</Prezime>
            <Ime property="pred:ime">Mika</Ime>
            <Ime_roditelja>Milenko</Ime_roditelja>
            <Pol>Muski</Pol>
            <Datum_rodjenja>1998-01-01</Datum_rodjenja>
            <Mesto_rodjenja>Novi Sad</Mesto_rodjenja>
            <Adresa>
                <Ulica>Jevrejska</Ulica>
                <Broj>55</Broj>
                <Mesto>Novi Sad</Mesto>
                <Grad>Novi Sad</Grad>
            </Adresa>
            <Kontakt_informacije>
                <Fiksni_telefon>021 120 456</Fiksni_telefon>
                <Mobilni_telefon>065 120 45 67</Mobilni_telefon>
                <Email property="pred:email">mika@gmail.com</Email>
            </Kontakt_informacije>
            <Radni_status>Zaposlen</Radni_status>
            <Zanimanje_zaposlenog>prosveta</Zanimanje_zaposlenog>
            <Socijalna_zastita>
                <Naziv_sedista>Novi Sad</Naziv_sedista>
                <Opstina_sedista>Novi Sad</Opstina_sedista>
            </Socijalna_zastita>
        </Licni_podaci>
        <Saglasnost_pacijenta>
            <Naziv_imunoloskog_lekara>Boban</Naziv_imunoloskog_lekara>
        </Saglasnost_pacijenta>
        <Datum property="pred:datum_termina">2021-12-10</Datum>
    </Pacijent>
    <Evidencija_o_vakcinaciji>
        <Zdravstvena_ustanova>Dom Zdravlja, Novi Sad</Zdravstvena_ustanova>
        <Vakcinacijski_punkt>5</Vakcinacijski_punkt>
        <Lekar>
            <Ime>Boban</Ime>
            <Prezime>Mikic</Prezime>
            <Telefon>065 765 43 21</Telefon>
        </Lekar>
        <Vakcine>
            <Vakcina  Doza="1">
                <Naziv>Pfizer-BioNTech</Naziv>
                <Datum_davanja>2021-09-08</Datum_davanja>
                <Nacin_davanja>IM</Nacin_davanja>
                <Ekstremiter>desna ruka</Ekstremiter>
                <Serija>1</Serija>
                <Proizvodjac>Pfizer</Proizvodjac>
                <Nezeljena_reakcija></Nezeljena_reakcija>
            </Vakcina>
            <Vakcina Doza="2">
                <Naziv>Pfizer-BioNTech</Naziv>
                <Datum_davanja>2021-12-10</Datum_davanja>
                <Nacin_davanja>IM</Nacin_davanja>
                <Ekstremiter>desna ruka</Ekstremiter>
                <Serija>1</Serija>
                <Proizvodjac>cgfbv</Proizvodjac>
                <Nezeljena_reakcija>hf</Nezeljena_reakcija>
            </Vakcina>
            <Privremene_kontraindikacije>
                <Datum_utvrdjivanja>2021-12-10</Datum_utvrdjivanja>
                <Dijagnoza>Povisena temperatura</Dijagnoza>
            </Privremene_kontraindikacije>
            <Odluka_komisije_za_trajne_kontraindikacije></Odluka_komisije_za_trajne_kontraindikacije>
        </Vakcine>
    </Evidencija_o_vakcinaciji>
</Saglasnost>